{"$schema":"https://json-schema.org/draft/2020-12/schema","$id":"https://thedailyline.bet/schemas/video/v1/content-candidate.schema.json","title":"ContentCandidate","type":"object","additionalProperties":false,"required":["schema_version","candidate_id","fact_package_refs","fact_package_bindings","primary_scope_ref","sport","story_family_eligibility","content_priority_hint","urgency","expires_at","recommended_duration_band","required_claim_refs","optional_claim_refs","allowed_cta_profiles","required_disclaimer_profile_ref","candidate_digest"],"properties":{"schema_version":{"const":"content-candidate.v1"},"candidate_id":{"$ref":"common.schema.json#/$defs/Id"},"fact_package_refs":{"$ref":"common.schema.json#/$defs/RefSet"},"fact_package_bindings":{"type":"array","minItems":1,"items":{"$ref":"common.schema.json#/$defs/DigestRef"}},"primary_scope_ref":{"$ref":"common.schema.json#/$defs/Ref"},"sport":{"type":"string","minLength":1},"story_family_eligibility":{"$ref":"common.schema.json#/$defs/StringSet"},"content_priority_hint":{"type":"integer","minimum":0,"maximum":1000},"urgency":{"enum":["LOW","NORMAL","HIGH","IMMEDIATE"]},"expires_at":{"$ref":"common.schema.json#/$defs/Timestamp"},"recommended_duration_band":{"type":"object","additionalProperties":false,"required":["min_ms","max_ms"],"properties":{"min_ms":{"type":"integer","minimum":1},"max_ms":{"type":"integer","minimum":1}}},"required_claim_refs":{"$ref":"common.schema.json#/$defs/RefSet"},"optional_claim_refs":{"$ref":"common.schema.json#/$defs/RefSet"},"allowed_cta_profiles":{"$ref":"common.schema.json#/$defs/RefSet"},"required_disclaimer_profile_ref":{"$ref":"common.schema.json#/$defs/Ref"},"evaluation_set_ref":{"oneOf":[{"$ref":"common.schema.json#/$defs/Ref"},{"type":"null"}]},"candidate_digest":{"$ref":"common.schema.json#/$defs/Digest"}}}
