{"schema_version":"content-candidate.v1","candidate_id":"candidate.mlb.sf-lad.single-pick.1","fact_package_refs":["pfp.mlb.sf-lad.20260908.v1"],"fact_package_bindings":[{"ref":"pfp.mlb.sf-lad.20260908.v1","digest":"sha256:2abfa3c2a8c07afe7b60d5d7645c594a06ba87164c13252b0351dc9ba5d95c1a"}],"primary_scope_ref":"mlb-game-sf-lad-20260908","sport":"MLB","story_family_eligibility":["single_pick"],"content_priority_hint":700,"urgency":"NORMAL","expires_at":"2026-09-08T23:30:00Z","recommended_duration_band":{"min_ms":15000,"max_ms":25000},"required_claim_refs":["claim.pick","claim.model-edge"],"optional_claim_refs":[],"allowed_cta_profiles":["follow-daily-line.v1"],"required_disclaimer_profile_ref":"sports-betting-general.v1","evaluation_set_ref":null,"candidate_digest":"sha256:b0c14a2b0653ff727b2c5833a171447700d829f629b22af83f458b4ec731b9fd"}
